{
  "schema_version": "gatekeeper-artifact-v1.0",
  "timestamp": "2026-01-28T20:29:47.011916+00:00",
  "filepath": "/Users/frank/projects/claude-code-judge/verdict_signer.py",
  "mode": "repair-dry-run",
  "profile": "strict",
  "summary": {
    "initial_failure_count": 3,
    "final_failure_count": 0,
    "iterations_used": 1,
    "repair_confidence": 1.0,
    "improved": true,
    "fully_repaired": true
  },
  "failures": {
    "initial": [
      "Line 8: Function missing docstring",
      "Line 22: Function missing docstring",
      "Line 39: Function missing docstring"
    ],
    "final": []
  },
  "iterations": [
    {
      "iteration": 1,
      "failures_before": 3,
      "repairs_proposed": 3,
      "repairs": [
        {
          "line": 8,
          "old": "    def __init__(self, secret_key: str):",
          "new": "    def __init__(self, secret_key: str):\n        \"\"\"Initialize the signer with a secret key.\"\"\"",
          "reason": "Function missing docstring",
          "category": "docstring",
          "blocking": true
        },
        {
          "line": 22,
          "old": "    def sign(self, verdict: Dict[str, Any]) -> Dict[str, Any]:",
          "new": "    def sign(self, verdict: Dict[str, Any]) -> Dict[str, Any]:\n        \"\"\"Sign a verdict and return it with signature attached.\"\"\"",
          "reason": "Function missing docstring",
          "category": "docstring",
          "blocking": true
        },
        {
          "line": 39,
          "old": "    def verify(self, verdict: Dict[str, Any]) -> bool:",
          "new": "    def verify(self, verdict: Dict[str, Any]) -> bool:\n        \"\"\"Verify the signature of a verdict.\"\"\"",
          "reason": "Function missing docstring",
          "category": "docstring",
          "blocking": true
        }
      ]
    }
  ],
  "diff": {
    "before": "import json\nimport hmac\nimport hashlib\nfrom typing import Dict, Any\n\n\nclass VerdictSigner:\n    def __init__(self, secret_key: str):\n        if not secret_key:\n            raise ValueError(\"Signing key must not be empty\")\n        self.secret_key = secret_key.encode(\"utf-8\")\n\n    def _canonical_json(self, verdict: Dict[str, Any]) -> bytes:\n        \"\"\"\n        Deterministic JSON encoding for signing.\n        Excludes existing signature if present.\n        \"\"\"\n        clean = dict(verdict)\n        clean.pop(\"signature\", None)\n        return json.dumps(clean, sort_keys=True, separators=(\",\", \":\")).encode(\"utf-8\")\n\n    def sign(self, verdict: Dict[str, Any]) -> Dict[str, Any]:\n        payload = self._canonical_json(verdict)\n\n        sig = hmac.new(\n            self.secret_key,\n            payload,\n            hashlib.sha256\n        ).hexdigest()\n\n        signed = dict(verdict)\n        signed[\"signature\"] = {\n            \"alg\": \"HMAC-SHA256\",\n            \"value\": sig,\n        }\n\n        return signed\n\n    def verify(self, verdict: Dict[str, Any]) -> bool:\n        sig_block = verdict.get(\"signature\")\n        if not sig_block:\n            return False\n\n        expected = sig_block.get(\"value\")\n        if not expected:\n            return False\n\n        payload = self._canonical_json(verdict)\n\n        actual = hmac.new(\n            self.secret_key,\n            payload,\n            hashlib.sha256\n        ).hexdigest()\n\n        return hmac.compare_digest(actual, expected)\n",
    "after": "import json\nimport hmac\nimport hashlib\nfrom typing import Dict, Any\n\n\nclass VerdictSigner:\n    def __init__(self, secret_key: str):\n        \"\"\"Initialize the signer with a secret key.\"\"\"\n        if not secret_key:\n            raise ValueError(\"Signing key must not be empty\")\n        self.secret_key = secret_key.encode(\"utf-8\")\n\n    def _canonical_json(self, verdict: Dict[str, Any]) -> bytes:\n        \"\"\"\n        Deterministic JSON encoding for signing.\n        Excludes existing signature if present.\n        \"\"\"\n        clean = dict(verdict)\n        clean.pop(\"signature\", None)\n        return json.dumps(clean, sort_keys=True, separators=(\",\", \":\")).encode(\"utf-8\")\n\n    def sign(self, verdict: Dict[str, Any]) -> Dict[str, Any]:\n        \"\"\"Sign a verdict and return it with signature attached.\"\"\"\n        payload = self._canonical_json(verdict)\n\n        sig = hmac.new(\n            self.secret_key,\n            payload,\n            hashlib.sha256\n        ).hexdigest()\n\n        signed = dict(verdict)\n        signed[\"signature\"] = {\n            \"alg\": \"HMAC-SHA256\",\n            \"value\": sig,\n        }\n\n        return signed\n\n    def verify(self, verdict: Dict[str, Any]) -> bool:\n        \"\"\"Verify the signature of a verdict.\"\"\"\n        sig_block = verdict.get(\"signature\")\n        if not sig_block:\n            return False\n\n        expected = sig_block.get(\"value\")\n        if not expected:\n            return False\n\n        payload = self._canonical_json(verdict)\n\n        actual = hmac.new(\n            self.secret_key,\n            payload,\n            hashlib.sha256\n        ).hexdigest()\n\n        return hmac.compare_digest(actual, expected)\n"
  },
  "metadata": {
    "gatekeeper_version": "1.0.0",
    "created_at": "2026-01-28T20:29:47.011916+00:00"
  }
}