{
  "schema_version": "gatekeeper-artifact-v1.0",
  "timestamp": "2026-01-28T20:29:27.453512+00:00",
  "filepath": "/Users/frank/projects/claude-code-judge/submissions/has_secret.py",
  "mode": "repair-dry-run",
  "profile": "strict",
  "summary": {
    "initial_failure_count": 1,
    "final_failure_count": 0,
    "iterations_used": 1,
    "repair_confidence": 1.0,
    "improved": true,
    "fully_repaired": true
  },
  "failures": {
    "initial": [
      "Line 5: Function missing docstring"
    ],
    "final": []
  },
  "iterations": [
    {
      "iteration": 1,
      "failures_before": 1,
      "repairs_proposed": 1,
      "repairs": [
        {
          "line": 5,
          "old": "def get_token():",
          "new": "def get_token():\n    \"\"\"Return the authentication token.\"\"\"",
          "reason": "Function missing docstring",
          "category": "docstring",
          "blocking": true
        }
      ]
    }
  ],
  "diff": {
    "before": "# File with hardcoded credential\nAPI_KEY = \"sk-1234567890abcdefghijk\"\nTOKEN = \"ghp_XxXxXxXxXxXxXxXxXxXx\"\n\ndef get_token():\n    return TOKEN\n",
    "after": "# File with hardcoded credential\nAPI_KEY = \"sk-1234567890abcdefghijk\"\nTOKEN = \"ghp_XxXxXxXxXxXxXxXxXxXx\"\n\ndef get_token():\n    \"\"\"Return the authentication token.\"\"\"\n    return TOKEN\n"
  },
  "metadata": {
    "gatekeeper_version": "1.0.0",
    "created_at": "2026-01-28T20:29:27.453512+00:00"
  }
}